{
  "schemaVersion": 1,
  "status": "optimized_intro_storyboard_manifest_v364",
  "runtimeLoaded": false,
  "runtimeBasePath": "assets/rtp/storyboards/",
  "storyboards": [
    {
      "id": "storyboard.intro.reception_debt",
      "eventId": "event.intro.reception_debt",
      "sourceType": "explicit",
      "source": "storyboard_explicit",
      "loadPolicy": "lazy_on_new_game_intro_start",
      "textBakedIntoImage": true,
      "trigger": "new_game_only_before_guided_tour",
      "afterComplete": "start_guided_tour",
      "sourceDimensions": {
        "width": 768,
        "height": 2258
      },
      "panels": [
        {
          "id": "intro_panel_00",
          "order": 0,
          "title": "Benvenuto al Camping Imperio",
          "caption": "Versilia",
          "summary": "Arrivi in Versilia per riposarti. Nel Camping Imperio, però, una pessima idea è già in viaggio.",
          "path": "intro/panels/intro_panel_00.webp",
          "width": 900,
          "height": 600,
          "format": "webp",
          "durationMs": 5000,
          "sourceRect": {
            "x": 0,
            "y": 0,
            "width": 900,
            "height": 600
          },
          "readerCaption": "Arrivi in Versilia per riposarti. Nel Camping Imperio, però, una pessima idea è già in viaggio.",
          "beatType": "setup",
          "focusCharacter": "player",
          "recommendedDurationMs": 5000,
          "motion": {
            "type": "slow_zoom",
            "intensity": "subtle"
          },
          "audioCue": {
            "type": "camp_ambience",
            "intensity": "low"
          },
          "transition": "soft_fade",
          "accessibilityAlt": "Ingresso illustrato del Camping Imperio in Versilia, tra pini, caravan e reception.",
          "continuityBefore": "",
          "continuityAfter": "Il punto di vista passa dal camping al suo proprietario."
        },
        {
          "id": "intro_panel_01",
          "order": 1,
          "title": "L'idea avida",
          "caption": "Imperio cerca il lusso al prezzo sbagliato",
          "summary": "Imperio sogna sabbia bianca e decide che risparmiare vale più del buon senso.",
          "path": "intro/panels/intro_panel_01.webp",
          "width": 522,
          "height": 632,
          "format": "webp",
          "durationMs": 5600,
          "sourceRect": {
            "x": 5,
            "y": 50,
            "width": 261,
            "height": 316
          },
          "readerCaption": "Imperio sogna sabbia bianca e decide che risparmiare vale più del buon senso.",
          "beatType": "cause",
          "focusCharacter": "imperio",
          "recommendedDurationMs": 5600,
          "motion": {
            "type": "slow_zoom",
            "intensity": "subtle"
          },
          "audioCue": {
            "type": "cash",
            "intensity": "medium"
          },
          "transition": "soft_fade",
          "accessibilityAlt": "L'idea avida. Imperio sogna sabbia bianca e decide che risparmiare vale più del buon senso.",
          "continuityBefore": "",
          "continuityAfter": ""
        },
        {
          "id": "intro_panel_02",
          "order": 2,
          "title": "Ordine clandestino",
          "caption": "La trappola parte da una telefonata",
          "summary": "Il fornitore riceve un ordine ambiguo: sulla carta è sabbia da VIP, nella realtà è ghiaione.",
          "path": "intro/panels/intro_panel_02.webp",
          "width": 900,
          "height": 599,
          "format": "webp",
          "durationMs": 5800,
          "sourceRect": {
            "x": 273,
            "y": 50,
            "width": 487,
            "height": 324
          },
          "readerCaption": "Il fornitore riceve un ordine ambiguo: sulla carta è sabbia da VIP, nella realtà è ghiaione.",
          "beatType": "cause",
          "focusCharacter": "imperio",
          "recommendedDurationMs": 5800,
          "motion": {
            "type": "pan_right",
            "intensity": "subtle"
          },
          "audioCue": {
            "type": "office_phone",
            "intensity": "medium"
          },
          "transition": "soft_fade",
          "accessibilityAlt": "Ordine clandestino. Il fornitore riceve un ordine ambiguo: sulla carta è sabbia da VIP, nella realtà è ghiaione.",
          "continuityBefore": "",
          "continuityAfter": ""
        },
        {
          "id": "intro_panel_03",
          "order": 3,
          "title": "Prezzo basso, guaio alto",
          "caption": "Imperio chiude l'affare peggiore",
          "summary": "Imperio pretende il prezzo più basso e firma, senza saperlo, la condanna del campeggio.",
          "path": "intro/panels/intro_panel_03.webp",
          "width": 522,
          "height": 640,
          "format": "webp",
          "durationMs": 5200,
          "sourceRect": {
            "x": 5,
            "y": 373,
            "width": 261,
            "height": 320
          },
          "readerCaption": "Imperio pretende il prezzo più basso e firma, senza saperlo, la condanna del campeggio.",
          "beatType": "cause",
          "focusCharacter": "imperio",
          "recommendedDurationMs": 5200,
          "motion": {
            "type": "slow_zoom",
            "intensity": "subtle"
          },
          "audioCue": {
            "type": "phone",
            "intensity": "medium"
          },
          "transition": "soft_fade",
          "accessibilityAlt": "Prezzo basso, guaio alto. Imperio pretende il prezzo più basso e firma, senza saperlo, la condanna del campeggio.",
          "continuityBefore": "",
          "continuityAfter": ""
        },
        {
          "id": "intro_panel_04",
          "order": 4,
          "title": "Il camion arriva",
          "caption": "Il Ghaione entra nel camping",
          "summary": "Il camion varca il cancello: la vacanza tranquilla sta per finire sotto una montagna di sassi.",
          "path": "intro/panels/intro_panel_04.webp",
          "width": 900,
          "height": 611,
          "format": "webp",
          "durationMs": 4600,
          "sourceRect": {
            "x": 286,
            "y": 373,
            "width": 476,
            "height": 323
          },
          "readerCaption": "Il camion varca il cancello: la vacanza tranquilla sta per finire sotto una montagna di sassi.",
          "beatType": "approach",
          "focusCharacter": "system",
          "recommendedDurationMs": 4600,
          "motion": {
            "type": "pan_left",
            "intensity": "subtle"
          },
          "audioCue": {
            "type": "truck",
            "intensity": "medium"
          },
          "transition": "soft_fade",
          "accessibilityAlt": "Il camion arriva. Il camion varca il cancello: la vacanza tranquilla sta per finire sotto una montagna di sassi.",
          "continuityBefore": "",
          "continuityAfter": ""
        },
        {
          "id": "intro_panel_05",
          "order": 5,
          "title": "Lo scarico",
          "caption": "Il disastro diventa pubblico",
          "summary": "Il carico precipita a terra con un rombo che nessuno può ignorare.",
          "path": "intro/panels/intro_panel_05.webp",
          "width": 810,
          "height": 598,
          "format": "webp",
          "durationMs": 3400,
          "sourceRect": {
            "x": 5,
            "y": 696,
            "width": 405,
            "height": 299
          },
          "readerCaption": "Il carico precipita a terra con un rombo che nessuno può ignorare.",
          "beatType": "impact",
          "focusCharacter": "system",
          "recommendedDurationMs": 3400,
          "motion": {
            "type": "impact_shake",
            "intensity": "medium"
          },
          "audioCue": {
            "type": "stone_crash",
            "intensity": "medium"
          },
          "transition": "cut",
          "accessibilityAlt": "Lo scarico. Il carico precipita a terra con un rombo che nessuno può ignorare.",
          "continuityBefore": "",
          "continuityAfter": ""
        },
        {
          "id": "intro_panel_06",
          "order": 6,
          "title": "Il primo dolore",
          "caption": "La vacanza cambia tono",
          "summary": "Il protagonista sente sulla pelle che quel mucchio non sarà solo un problema di Imperio.",
          "path": "intro/panels/intro_panel_06.webp",
          "width": 698,
          "height": 598,
          "format": "webp",
          "durationMs": 4400,
          "sourceRect": {
            "x": 413,
            "y": 696,
            "width": 349,
            "height": 299
          },
          "readerCaption": "Il protagonista sente sulla pelle che quel mucchio non sarà solo un problema di Imperio.",
          "beatType": "player_hook",
          "focusCharacter": "player",
          "recommendedDurationMs": 4400,
          "motion": {
            "type": "quick_zoom",
            "intensity": "medium"
          },
          "audioCue": {
            "type": "hurt",
            "intensity": "medium"
          },
          "transition": "soft_fade",
          "accessibilityAlt": "Il primo dolore. Il protagonista sente sulla pelle che quel mucchio non sarà solo un problema di Imperio.",
          "continuityBefore": "",
          "continuityAfter": ""
        },
        {
          "id": "intro_panel_07",
          "order": 7,
          "title": "La protesta",
          "caption": "Il campeggio si accende",
          "summary": "La folla capisce il trucco: la rabbia diventa organizzazione.",
          "path": "intro/panels/intro_panel_07.webp",
          "width": 780,
          "height": 662,